{
  "schema_version": "0.1.0",
  "annotation_id": "annotation-0001",
  "meeting_id": "meeting-demo-001",
  "annotation_kind": "human_seal",
  "target": {
    "target_type": "artifact",
    "target_id": "artifact-decision-report-v1"
  },
  "author_type": "human_arbiter",
  "author_id": "owner",
  "seal": {
    "decision": "accepted_with_reservations",
    "statement": "接受当前版本作为本次会议正式结果，但保留待验证问题。",
    "sealed_version": 1
  },
  "created_at": "2026-08-07T17:35:00+08:00"
}
